"citation_id","citation","year","research_field","corpus","languages","phenomenon","textual_unit","method","supervised_or_unsupervised","training_data","benchmark","evaluation_method","expert_review","code_available","data_available","claimed_novelty","limitations","relevance_to_project_echoes","review_status","notes"
"naaijer_roorda_2016","Naaijer, Martijn, and Dirk Roorda. 2016. ""Parallel Texts in the Hebrew Bible, New Methods and Visualizations."" arXiv:1603.01541. https://doi.org/10.48550/arXiv.1603.01541.","2016","computational biblical studies; digital humanities; text reuse","Complete Masoretic Text from ETCBC/BHSA; separate MT Isaiah–1QIsaa visualization","Biblical Hebrew","lexical parallel passages; text reuse","10/20/50/100-word chunks; sentence; half-verse; verse; chapter","All-by-all chunk comparison; lexeme-set intersection-over-union; Levenshtein/LCS similarity; clique thresholding; synoptic visualization","unsupervised","none","Well-known Hebrew Bible parallels and 2 Kings 19–25 case study; no formal held-out gold set reported","165 parameter experiments; automatic clique/longest-clique heuristic; qualitative recovery and miss analysis","Scholarly qualitative review by authors; no independent blinded adjudication reported","yes: https://github.com/ETCBC/parallels","yes: ETCBC repository, annotations, output, and archived data","Authors present an open-source online tool for detecting and synoptically visualizing Hebrew Bible parallels","Lexical only; semantic and order-based parallels missed; threshold and chunk choices define results; formulaic and drifting cliques","Closest transparent precedent for undirected all-pairs full-Hebrew-Bible lexical search; lacks GNT, independent detector families, knownness workflow, and persistent rejection ledger","verified_primary_source","Paper: https://arxiv.org/abs/1603.01541 | Project: https://github.com/ETCBC/parallels | Data DOI: https://doi.org/10.5281/zenodo.1007643"
"mcgovern_etal_2024_narrative","McGovern, Hope, Hale Sirin, Tom Lippincott, and Andrew Caines. 2024. ""Detecting Narrative Patterns in Biblical Hebrew and Greek."" Proceedings of the 1st Workshop on Machine Learning for Ancient Languages, 269–279. https://doi.org/10.18653/v1/2024.ml4al-1.26.","2024","computational narrative; biblical studies; information retrieval","Leningrad Codex Hebrew Bible; Greek LXX plus SBLGNT; OpenBible cross-references","Biblical Hebrew; Ancient/Koine Greek","recurring narrative patterns; type-scenes","query verse with surrounding context; candidate verse or chapter","Siamese BERT-like encoders; contrastive triplet-margin training on cross-reference pairs and random negatives; dot-product retrieval","weakly supervised","OpenBible cross-reference pairs with vote threshold >=5; random negative verses; 90/10 train-validation split; pretrained Hebrew and Greek encoders","17,899 Hebrew and 45,297 Greek cross-reference pairs; nine manually constructed type-scene queries","Recall@k from 1 to 50; ablations for model, masking, batch size, and context window; manual error analysis","Language expert helped craft Hebrew queries; Greek queries were LLM-generated then manually verified; no comprehensive independent type-scene gold set","uncertain: paper claims public code but prints non-actionable anonymous/repo URL","partial: source corpora and OpenBible links are public; processed splits were not verified","Authors present a novel cross-reference-trained retrieval approach for extracting biblical type-scenes","Low recall; random negatives; single verses often too small; Greek query generation used an LLM; crowd-reference and translation circularity; reported Greek corpus has 64 books","Direct narrative-detector precedent across Hebrew and Greek; unlike Echoes it is query-directed, weakly supervised by known links, and lacks independent evidence-family agreement","verified_primary_source","Paper and metadata: https://aclanthology.org/2024.ml4al-1.26/ | DOI: https://doi.org/10.18653/v1/2024.ml4al-1.26"
"mcgovern_sirin_lippincott_2025_chiasmus","McGovern, Hope, Hale Sirin, and Tom Lippincott. 2025. ""Computational Discovery of Chiasmus in Ancient Religious Text."" Proceedings of NAACL-HLT 2025, Volume 2: Short Papers, 154–160. https://doi.org/10.18653/v1/2025.naacl-short.13.","2025","computational rhetoric; biblical studies; structural pattern detection","Translator's Amalgamated Hebrew Old Testament based on the Leningrad Codex","Biblical Hebrew","chiasmus; chiastic and non-chiastic structural repetition","half-verse and verse; sliding windows of 4–8 units","Multilingual E5-small embeddings; cosine similarity matrix; paired-versus-nonpaired structural score; corpus z-score threshold","unsupervised detector with post-hoc human evaluation","No task-specific training; pretrained multilingual E5","Top 50 half-verse and top 50 verse candidates manually annotated into three classes","Precision@k 0.60 half-verse and 0.80 verse; Cohen kappa 0.76 and 0.89; qualitative distribution analysis","Two author-annotators with graduate-level ancient-language and literature training","yes: https://github.com/comp-int-hum/literary-translation","yes: repository outputs and formatted STEP Bible dataset DOI 10.57967/hf/4174","Authors claim the first systematic computational approach and mathematical formalization for biblical chiasmus detection","Hebrew OT only; verse and half-verse structures only; no narrative-level chiasmus; top-k evaluation cannot measure recall; formulaic repetition is frequent","Strong precedent for Echoes' structural detector, but not cross-passage whole-Hebrew-plus-Greek discovery or a multi-family ensemble","verified_primary_source","Paper: https://aclanthology.org/2025.naacl-short.13/ | DOI: https://doi.org/10.18653/v1/2025.naacl-short.13 | Code: https://github.com/comp-int-hum/literary-translation | Dataset DOI: https://doi.org/10.57967/hf/4174"
"smiley_2025","Smiley, David M. 2025. ""Intertextual Parallel Detection in Biblical Hebrew: A Transformer-Based Benchmark."" arXiv:2506.24117v2. https://doi.org/10.48550/arXiv.2506.24117.","2025","computational biblical Hebrew; natural-language processing; semantic retrieval","BHSA; 558 recognized Chronicles verses with parallels in Samuel/Kings","Biblical Hebrew","known intertextual and synoptic parallel passages","verse","E5, AlephBERT, MPNet, and LaBSE verse embeddings; cosine similarity; Wasserstein distribution distance; nearest-neighbor classification","zero-shot task evaluation using externally pretrained models","No task-specific training; pretrained transformer corpora, including Modern Hebrew for AlephBERT","558 known parallel verses; all other Samuel/Kings verses used as non-parallel comparisons","Parallel/non-parallel cosine distributions; t-tests; Wasserstein distance; nearest-neighbor precision, recall, and F1; E5 F1 0.88 and AlephBERT F1 0.87","Uses a published scholarly parallel synopsis; no new independent expert adjudication reported","yes: https://github.com/dmsmiley/detect-bh","yes: code repository includes data","Authors claim the first comprehensive transformer-model benchmark for detecting biblical parallels","Restricted to known narrative parallels; other genres untested; embeddings opaque; models not Biblical-Hebrew-specific; unlisted verses may include unlabeled positives","Useful precedent for Echoes' semantic benchmark and hard-negative design; not whole-canon, undirected, interpretable, or multi-family discovery","verified_primary_source","Preprint: https://arxiv.org/abs/2506.24117 | DOI: https://doi.org/10.48550/arXiv.2506.24117 | Code/data: https://github.com/dmsmiley/detect-bh"
"de_la_selle_mellerin_2026","de la Selle, Théotime, and Laurence Mellerin. 2026. ""Detection and Typology of Psalmic Text Reuses in the New Testament."" Religions 17(1):88. https://doi.org/10.3390/rel17010088.","2026","computational intertextuality; ancient Greek NLP; text reuse","7,939 Greek New Testament verses; 3,093 manually segmented LXX Psalm verse-parts; 24,555,327 possible pairs; 614-item initial gold standard","Ancient Greek","Psalm quotations, allusions, echoes, coincidences, and thematic reuse in the New Testament","New Testament verse paired with Psalm verse-part","Eight representations—tokens, lemmas, POS, stop words, filtered lemmas, synonym lexicon, semantic domains, and subdomains—under two normalizations; Levenshtein and custom set distance; ranking and K-means clustering","unsupervised","none; gold standard reserved for validation and interpretation","614 literature-derived, manually typologized reuses, later augmented to 682 after reviewing detector output","Top-240 recovery against gold and Passim; source-verse prediction rates; K-means typology coherence; manual review of proposed additions","Extensive literature-derived gold set; manual Psalm segmentation, tagging, semantic-domain completion, typology, and top-result review","yes: https://github.com/Tdelaselle/Psalms_in_NT","yes: code, processed representations, and datasets in project repository","Authors introduce a transparent literal/grammatical/lexical/semantic pair model and report 68 possible previously unpublished reuses; they also state none of the new detections is useful for exegetical or theological analysis","Psalms-to-NT only; Septuagint variants excluded; patchwork resources and substantial manual completion; weak implicit-echo performance; detector-derived gold augmentation risks non-independent evaluation","Closest multi-representation original-Greek intrabiblical detector and limited known-link check; lacks full corpus, Hebrew triangulation, independent detector-family agreement, and broad knownness workflow","verified_primary_source","Article: https://www.mdpi.com/2077-1444/17/1/88 | DOI: https://doi.org/10.3390/rel17010088 | Code/data: https://github.com/Tdelaselle/Psalms_in_NT"
